{
    "$schema": "./product-metadata.schema.json",
    "applicationVersion": "1.0.3",
    "modelVersion": "2026.08.11",
    "protocolVersion": 2,
    "profileInterchangeVersion": 4,
    "dragDataInterchangeVersion": 1,
    "settingsSchemaVersion": 11,
    "limits": {
        "calculationRequestBytes": 1048576,
        "engineResponseBytes": 16777216,
        "profileDocumentBytes": 1048576,
        "dragDataDocumentBytes": 1048576,
        "csvExportBytes": 67108864
    }
}
